<?xml version="1.0"?>
<!DOCTYPE establecimiento SYSTEM "establecimiento.dtd">
<establecimiento idEstablecimiento="3">
  <nombre>Tienda USM</nombre>
  <rut>
	<numero>98765000</numero>
	<dv>0</dv>
  </rut>
  <ubicacion>
    <pais>CHILE</pais>
    <region>Metropolitana</region>
    <ciudad>SANTIAGO</ciudad>
    <comuna>Vitacura</comuna>
    <calle>Avenida Santa Maria</calle>
    <numero>6400</numero>
	<coordenada>
		<latitud>-33.3775228</latitud>
		<longitud>-70.5774312</longitud>
	</coordenada>
  </ubicacion>
  <telefono>
	<codigoPais>56</codigoPais>
	<prefijo>32</prefijo>
	<numero>2654678</numero>
  </telefono>
  <horario>Sin informaci√≥n</horario>
</establecimiento>